{
  "schemaVersion": 1,
  "project": {
    "id": "riptidegp1",
    "name": "Riptide GP1",
    "description": "Experimente o futuro da corrida ilícita de motos aquáticas, onde pilotos em armaduras dão acrobacias que desafiam a morte sobre imensas cachoeiras, desviam-se de policiais em rotas aquáticas públicas e passam em velocidades alucinantes pelas ondas que vão surgindo.",
    "homepage": "https://ferreiratechlaboficial.web.app/",
    "source": "https://ferreiratechlaboficial.web.app/",
    "license": "MIT",
    "porter": {
      "name": "FerreiraTechLab",
      "url": "https://ferreiratechlaboficial.web.app/"
    },
    "redistribution": {
      "allowed": true,
      "evidence": "https://ferreiratechlaboficial.web.app/licence"
    }
  },
  "submitter": {
    "name": "FerreiraTechLab",
    "url": "https://ferreiratechlaboficial.web.app/"
  },
  "release": {
    "version": "1.0.0",
    "revision": 1,
    "channel": "stable",
    "publishedAt": "2026-10-12T00:34:51.901Z",
    "notes": "teste",
    "variants": [
      {
        "id": "aarch64-portmaster",
        "priority": 100,
        "requiredCapabilities": [],
        "compatibility": {
          "architectures": [
            "aarch64"
          ],
          "firmwares": {
            "include": [
              "darkos",
              "rocknix",
              "aurknix"
            ]
          }
        },
        "requirements": {
          "readyToRun": true,
          "minimumRamMB": 128,
          "analogSticks": 0,
          "renderers": [],
          "runtimes": []
        },
        "package": {
          "path": "packages/riptidegp1.zip",
          "sizeBytes": 46211855,
          "sha256": "da9787277198d8417bbc181065a90dcb1529cf7811876f1c8882d832f1d54311"
        },
        "install": {
          "portId": "riptidegp1",
          "paths": [
            "Riptide GP1.sh",
            "riptidegp1/"
          ],
          "userDataPaths": []
        },
        "checks": [
          "hash",
          "zip-layout",
          "launcher",
          "license"
        ]
      }
    ]
  }
}
